{
  "soato": "1733223",
  "region_soato": "1733",
  "name_soato": "Хонқа тумани",
  "name_polygon_set": "Хонқа т.",
  "population_2026_official": 205300,
  "estimation_method": "GHS-POP",
  "calibration_factor": 1.179285,
  "mahallas_in_source": 44,
  "area_km2": 427.6879,
  "model_vs_official_gap": -0.152
}
