{
  "soato": "1706240",
  "region_soato": "1706",
  "name_soato": "Пешку тумани",
  "name_polygon_set": "Пешку т.",
  "population_2026_official": 135800,
  "estimation_method": "GHS-POP",
  "calibration_factor": 0.855551,
  "mahallas_in_source": 37,
  "area_km2": 8660.0278,
  "model_vs_official_gap": 0.1688
}
