{
  "soato": "1726277",
  "region_soato": "1726",
  "name_soato": "Шайхонтохур тумани",
  "name_polygon_set": "Шайхонтоҳур т.",
  "population_2026_official": 373700,
  "estimation_method": "здания OSM",
  "calibration_factor": 0.028243,
  "mahallas_in_source": 51,
  "area_km2": 26.9937,
  "model_vs_official_gap": -0.2082
}
