{
  "soato": "1712244",
  "region_soato": "1712",
  "name_soato": "Томди тумани",
  "name_polygon_set": "Томди т.",
  "population_2026_official": 15200,
  "estimation_method": "GHS-POP",
  "calibration_factor": 1.993681,
  "mahallas_in_source": 8,
  "area_km2": 35564.4857,
  "model_vs_official_gap": -0.4984
}
